{
  "name": "Trandoshan",
  "classification": "reptile",
  "designation": "sentient",
  "average_height": "200",
  "skin_colors": "brown, green",
  "hair_colors": "none",
  "eye_colors": "yellow, orange",
  "average_lifespan": "unknown",
  "homeworld": "https://sw.simplr.sh/api/planets/29.json",
  "language": "Dosh",
  "people": ["https://sw.simplr.sh/api/people/24.json"],
  "films": ["https://sw.simplr.sh/api/films/2.json"],
  "created": "2014-12-15T13:07:47.704000Z",
  "edited": "2014-12-20T21:36:42.151000Z",
  "url": "https://sw.simplr.sh/api/species/7.json"
}
