{
  "name": "Rodian",
  "classification": "sentient",
  "designation": "reptilian",
  "average_height": "170",
  "skin_colors": "green, blue",
  "hair_colors": "n/a",
  "eye_colors": "black",
  "average_lifespan": "unknown",
  "homeworld": "https://sw.simplr.sh/api/planets/23.json",
  "language": "Galatic Basic",
  "people": ["https://sw.simplr.sh/api/people/15.json"],
  "films": ["https://sw.simplr.sh/api/films/1.json"],
  "created": "2014-12-10T17:05:26.471000Z",
  "edited": "2014-12-20T21:36:42.144000Z",
  "url": "https://sw.simplr.sh/api/species/4.json"
}
