{
  "name": "Toydarian",
  "classification": "mammal",
  "designation": "sentient",
  "average_height": "120",
  "skin_colors": "blue, green, grey",
  "hair_colors": "none",
  "eye_colors": "yellow",
  "average_lifespan": "91",
  "homeworld": "https://sw.simplr.sh/api/planets/34.json",
  "language": "Toydarian",
  "people": ["https://sw.simplr.sh/api/people/40.json"],
  "films": [
    "https://sw.simplr.sh/api/films/4.json",
    "https://sw.simplr.sh/api/films/5.json"
  ],
  "created": "2014-12-19T17:48:56.893000Z",
  "edited": "2014-12-20T21:36:42.165000Z",
  "url": "https://sw.simplr.sh/api/species/13.json"
}
