{
  "name": "Tholothian",
  "classification": "mammal",
  "designation": "sentient",
  "average_height": "unknown",
  "skin_colors": "dark",
  "hair_colors": "unknown",
  "eye_colors": "blue, indigo",
  "average_lifespan": "unknown",
  "homeworld": "https://sw.simplr.sh/api/planets/46.json",
  "language": "unknown",
  "people": ["https://sw.simplr.sh/api/people/55.json"],
  "films": [
    "https://sw.simplr.sh/api/films/4.json",
    "https://sw.simplr.sh/api/films/6.json"
  ],
  "created": "2014-12-20T10:29:13.798000Z",
  "edited": "2014-12-20T21:36:42.186000Z",
  "url": "https://sw.simplr.sh/api/species/23.json"
}
