{
  "name": "Clawdite",
  "classification": "reptilian",
  "designation": "sentient",
  "average_height": "180",
  "skin_colors": "green, yellow",
  "hair_colors": "none",
  "eye_colors": "yellow",
  "average_lifespan": "70",
  "homeworld": "https://sw.simplr.sh/api/planets/54.json",
  "language": "Clawdite",
  "people": ["https://sw.simplr.sh/api/people/70.json"],
  "films": [
    "https://sw.simplr.sh/api/films/5.json",
    "https://sw.simplr.sh/api/films/6.json"
  ],
  "created": "2014-12-20T16:57:46.171000Z",
  "edited": "2014-12-20T21:36:42.199000Z",
  "url": "https://sw.simplr.sh/api/species/30.json"
}
