{
  "name": "Geonosian",
  "classification": "insectoid",
  "designation": "sentient",
  "average_height": "178",
  "skin_colors": "green, brown",
  "hair_colors": "none",
  "eye_colors": "green, hazel",
  "average_lifespan": "unknown",
  "homeworld": "https://sw.simplr.sh/api/planets/11.json",
  "language": "Geonosian",
  "people": ["https://sw.simplr.sh/api/people/63.json"],
  "films": [
    "https://sw.simplr.sh/api/films/5.json",
    "https://sw.simplr.sh/api/films/6.json"
  ],
  "created": "2014-12-20T16:40:45.618000Z",
  "edited": "2014-12-20T21:36:42.195000Z",
  "url": "https://sw.simplr.sh/api/species/28.json"
}
