{
  "name": "Mirialan",
  "classification": "mammal",
  "designation": "sentient",
  "average_height": "180",
  "skin_colors": "yellow, green",
  "hair_colors": "black, brown",
  "eye_colors": "blue, green, red, yellow, brown, orange",
  "average_lifespan": "unknown",
  "homeworld": "https://sw.simplr.sh/api/planets/51.json",
  "language": "Mirialan",
  "people": [
    "https://sw.simplr.sh/api/people/64.json",
    "https://sw.simplr.sh/api/people/65.json"
  ],
  "films": [
    "https://sw.simplr.sh/api/films/5.json",
    "https://sw.simplr.sh/api/films/6.json"
  ],
  "created": "2014-12-20T16:46:48.290000Z",
  "edited": "2014-12-20T21:36:42.197000Z",
  "url": "https://sw.simplr.sh/api/species/29.json"
}
