{
  "name": "Kaminoan",
  "classification": "amphibian",
  "designation": "sentient",
  "average_height": "220",
  "skin_colors": "grey, blue",
  "hair_colors": "none",
  "eye_colors": "black",
  "average_lifespan": "80",
  "homeworld": "https://sw.simplr.sh/api/planets/10.json",
  "language": "Kaminoan",
  "people": [
    "https://sw.simplr.sh/api/people/72.json",
    "https://sw.simplr.sh/api/people/73.json"
  ],
  "films": ["https://sw.simplr.sh/api/films/5.json"],
  "created": "2014-12-20T17:31:24.838000Z",
  "edited": "2014-12-20T21:36:42.202000Z",
  "url": "https://sw.simplr.sh/api/species/32.json"
}
