{
  "name": "Cerean",
  "classification": "mammal",
  "designation": "sentient",
  "average_height": "200",
  "skin_colors": "pale pink",
  "hair_colors": "red, blond, black, white",
  "eye_colors": "hazel",
  "average_lifespan": "unknown",
  "homeworld": "https://sw.simplr.sh/api/planets/43.json",
  "language": "Cerean",
  "people": ["https://sw.simplr.sh/api/people/52.json"],
  "films": [
    "https://sw.simplr.sh/api/films/4.json",
    "https://sw.simplr.sh/api/films/6.json"
  ],
  "created": "2014-12-20T10:15:33.765000Z",
  "edited": "2014-12-20T21:36:42.179000Z",
  "url": "https://sw.simplr.sh/api/species/20.json"
}
