{
  "name": "Mon Calamari",
  "classification": "amphibian",
  "designation": "sentient",
  "average_height": "160",
  "skin_colors": "red, blue, brown, magenta",
  "hair_colors": "none",
  "eye_colors": "yellow",
  "average_lifespan": "unknown",
  "homeworld": "https://sw.simplr.sh/api/planets/31.json",
  "language": "Mon Calamarian",
  "people": ["https://sw.simplr.sh/api/people/27.json"],
  "films": ["https://sw.simplr.sh/api/films/3.json"],
  "created": "2014-12-18T11:09:52.263000Z",
  "edited": "2014-12-20T21:36:42.153000Z",
  "url": "https://sw.simplr.sh/api/species/8.json"
}
