{
  "name": "Dug",
  "classification": "mammal",
  "designation": "sentient",
  "average_height": "100",
  "skin_colors": "brown, purple, grey, red",
  "hair_colors": "none",
  "eye_colors": "yellow, blue",
  "average_lifespan": "unknown",
  "homeworld": "https://sw.simplr.sh/api/planets/35.json",
  "language": "Dugese",
  "people": ["https://sw.simplr.sh/api/people/41.json"],
  "films": ["https://sw.simplr.sh/api/films/4.json"],
  "created": "2014-12-19T17:53:11.214000Z",
  "edited": "2014-12-20T21:36:42.167000Z",
  "url": "https://sw.simplr.sh/api/species/14.json"
}
