{
  "name": "Human",
  "classification": "mammal",
  "designation": "sentient",
  "average_height": "180",
  "skin_colors": "caucasian, black, asian, hispanic",
  "hair_colors": "blonde, brown, black, red",
  "eye_colors": "brown, blue, green, hazel, grey, amber",
  "average_lifespan": "120",
  "homeworld": "https://sw.simplr.sh/api/planets/9.json",
  "language": "Galactic Basic",
  "people": [
    "https://sw.simplr.sh/api/people/66.json",
    "https://sw.simplr.sh/api/people/67.json",
    "https://sw.simplr.sh/api/people/68.json",
    "https://sw.simplr.sh/api/people/74.json"
  ],
  "films": [
    "https://sw.simplr.sh/api/films/1.json",
    "https://sw.simplr.sh/api/films/2.json",
    "https://sw.simplr.sh/api/films/3.json",
    "https://sw.simplr.sh/api/films/4.json",
    "https://sw.simplr.sh/api/films/5.json",
    "https://sw.simplr.sh/api/films/6.json"
  ],
  "created": "2014-12-10T13:52:11.567000Z",
  "edited": "2014-12-20T21:36:42.136000Z",
  "url": "https://sw.simplr.sh/api/species/1.json"
}
