{
  "name": "Hutt",
  "classification": "gastropod",
  "designation": "sentient",
  "average_height": "300",
  "skin_colors": "green, brown, tan",
  "hair_colors": "n/a",
  "eye_colors": "yellow, red",
  "average_lifespan": "1000",
  "homeworld": "https://sw.simplr.sh/api/planets/24.json",
  "language": "Huttese",
  "people": ["https://sw.simplr.sh/api/people/16.json"],
  "films": [
    "https://sw.simplr.sh/api/films/1.json",
    "https://sw.simplr.sh/api/films/3.json"
  ],
  "created": "2014-12-10T17:12:50.410000Z",
  "edited": "2014-12-20T21:36:42.146000Z",
  "url": "https://sw.simplr.sh/api/species/5.json"
}
