{
  "name": "Wookie",
  "classification": "mammal",
  "designation": "sentient",
  "average_height": "210",
  "skin_colors": "gray",
  "hair_colors": "black, brown",
  "eye_colors": "blue, green, yellow, brown, golden, red",
  "average_lifespan": "400",
  "homeworld": "https://sw.simplr.sh/api/planets/14.json",
  "language": "Shyriiwook",
  "people": [
    "https://sw.simplr.sh/api/people/13.json",
    "https://sw.simplr.sh/api/people/80.json"
  ],
  "films": [
    "https://sw.simplr.sh/api/films/1.json",
    "https://sw.simplr.sh/api/films/2.json",
    "https://sw.simplr.sh/api/films/3.json",
    "https://sw.simplr.sh/api/films/6.json"
  ],
  "created": "2014-12-10T16:44:31.486000Z",
  "edited": "2014-12-20T21:36:42.142000Z",
  "url": "https://sw.simplr.sh/api/species/3.json"
}
