{
  "name": "Sullustan",
  "classification": "mammal",
  "designation": "sentient",
  "average_height": "180",
  "skin_colors": "pale",
  "hair_colors": "none",
  "eye_colors": "black",
  "average_lifespan": "unknown",
  "homeworld": "https://sw.simplr.sh/api/planets/33.json",
  "language": "Sullutese",
  "people": ["https://sw.simplr.sh/api/people/31.json"],
  "films": ["https://sw.simplr.sh/api/films/3.json"],
  "created": "2014-12-18T11:26:20.103000Z",
  "edited": "2014-12-20T21:36:42.157000Z",
  "url": "https://sw.simplr.sh/api/species/10.json"
}
