{
  "name": "Aleena",
  "classification": "reptile",
  "designation": "sentient",
  "average_height": "80",
  "skin_colors": "blue, gray",
  "hair_colors": "none",
  "eye_colors": "unknown",
  "average_lifespan": "79",
  "homeworld": "https://sw.simplr.sh/api/planets/38.json",
  "language": "Aleena",
  "people": ["https://sw.simplr.sh/api/people/47.json"],
  "films": ["https://sw.simplr.sh/api/films/4.json"],
  "created": "2014-12-20T09:53:16.481000Z",
  "edited": "2014-12-20T21:36:42.171000Z",
  "url": "https://sw.simplr.sh/api/species/16.json"
}
