{
  "name": "Vulptereen",
  "classification": "unknown",
  "designation": "sentient",
  "average_height": "100",
  "skin_colors": "grey",
  "hair_colors": "none",
  "eye_colors": "yellow",
  "average_lifespan": "unknown",
  "homeworld": "https://sw.simplr.sh/api/planets/39.json",
  "language": "vulpterish",
  "people": ["https://sw.simplr.sh/api/people/48.json"],
  "films": ["https://sw.simplr.sh/api/films/4.json"],
  "created": "2014-12-20T09:57:33.128000Z",
  "edited": "2014-12-20T21:36:42.173000Z",
  "url": "https://sw.simplr.sh/api/species/17.json"
}
