{
  "name": "Quermian",
  "classification": "mammal",
  "designation": "sentient",
  "average_height": "240",
  "skin_colors": "white",
  "hair_colors": "none",
  "eye_colors": "yellow",
  "average_lifespan": "86",
  "homeworld": "https://sw.simplr.sh/api/planets/48.json",
  "language": "Quermian",
  "people": ["https://sw.simplr.sh/api/people/57.json"],
  "films": [
    "https://sw.simplr.sh/api/films/4.json",
    "https://sw.simplr.sh/api/films/6.json"
  ],
  "created": "2014-12-20T10:34:50.827000Z",
  "edited": "2014-12-20T21:36:42.189000Z",
  "url": "https://sw.simplr.sh/api/species/25.json"
}
